{"$id":"urn:lima:v4:lima.repository-profile","$schema":"https://json-schema.org/draft/2020-12/schema","additionalProperties":false,"properties":{"binary_ratio_bp":{"type":"integer"},"build_systems":{"items":{"type":["object","string"]},"maxItems":4096,"type":"array"},"code_density_bp":{"type":"integer"},"code_roles":{"items":{"type":["object","string"]},"maxItems":4096,"type":"array"},"component_path":{"type":["object","string","array","null"]},"coverage_gaps":{"items":{"type":["object","string"]},"maxItems":4096,"type":"array"},"deployment_surface":{"items":{"type":["object","string"]},"maxItems":4096,"type":"array"},"entrypoints":{"items":{"type":["object","string"]},"maxItems":4096,"type":"array"},"execution_capability":{"type":"object"},"external_inputs":{"items":{"type":["object","string"]},"maxItems":4096,"type":"array"},"file_count":{"type":"integer"},"frameworks":{"items":{"type":["object","string"]},"maxItems":4096,"type":"array"},"generated_ratio_bp":{"type":"integer"},"languages":{"items":{"type":["object","string"]},"maxItems":4096,"type":"array"},"max_file_bytes":{"type":"integer"},"package_managers":{"items":{"type":["object","string"]},"maxItems":4096,"type":"array"},"repository_kinds":{"items":{"type":["object","string"]},"maxItems":4096,"type":"array"},"sensitive_operations":{"items":{"type":["object","string"]},"maxItems":4096,"type":"array"},"support_level":{"type":"string"},"total_bytes":{"type":"integer"},"trust_boundaries":{"items":{"type":["object","string"]},"maxItems":4096,"type":"array"}},"required":["binary_ratio_bp","build_systems","code_density_bp","code_roles","component_path","coverage_gaps","deployment_surface","entrypoints","execution_capability","external_inputs","file_count","frameworks","generated_ratio_bp","languages","max_file_bytes","package_managers","repository_kinds","sensitive_operations","support_level","total_bytes","trust_boundaries"],"title":"lima.repository-profile","type":"object"}