{"binary_ratio_bp":0,"build_systems":[{"detection":"declared","name":"hatchling","source_artifact_ids":["inventory"]}],"code_density_bp":1966,"code_roles":[],"component_path":null,"coverage_gaps":[],"deployment_surface":[],"entrypoints":[],"execution_capability":{"buildable":true,"requires_external_credentials":false,"requires_gpu":false,"requires_network":false,"requires_services":false,"testable":false},"external_inputs":[],"file_count":3,"frameworks":[],"generated_ratio_bp":0,"languages":[{"detection":"declared","name":"Python","source_artifact_ids":["inventory"]}],"max_file_bytes":139,"package_managers":[],"repository_kinds":["library"],"sensitive_operations":[],"support_level":"supported","total_bytes":173,"trust_boundaries":[]}