{"binary_ratio_bp":1250,"build_systems":[{"detection":"declared","name":"setuptools","source_artifact_ids":["tool-run-0001"]}],"code_density_bp":8200,"code_roles":[{"path":"src/cli.py","reason_codes":["PATH_PATTERN_SRC"],"role":"production","source_artifact_ids":["tool-run-0001"]},{"path":"src/example.py","reason_codes":["PATH_PATTERN_SRC"],"role":"production","source_artifact_ids":["tool-run-0001"]},{"path":"tests","reason_codes":["TEST_CONFIG_DISCOVERY"],"role":"test","source_artifact_ids":["tool-run-0001"]}],"component_path":null,"coverage_gaps":[{"detail":"Dynamic framework imports were not resolved; framework detection for src/example.py remains inferred.","gap_code":"FRAMEWORK_DETECTION_PARTIAL"}],"deployment_surface":[{"path":"Dockerfile","reason_codes":["CONTAINER_IMAGE_DECLARED"],"source_artifact_ids":["tool-run-0001"],"symbol":null}],"entrypoints":[{"path":"src/cli.py","reason_codes":["CLI_ENTRY_SCRIPT"],"source_artifact_ids":["tool-run-0001"],"symbol":"main"},{"path":"src/example.py","reason_codes":["MODULE_MAIN_GUARD"],"source_artifact_ids":["tool-run-0001"],"symbol":"run_command"}],"execution_capability":{"buildable":true,"requires_external_credentials":false,"requires_gpu":false,"requires_network":false,"requires_services":false,"testable":true},"external_inputs":[{"path":"src/cli.py","reason_codes":["CLI_ARGUMENT_READ"],"source_artifact_ids":["tool-run-0001"],"symbol":"main"}],"file_count":42,"frameworks":[{"detection":"inferred","name":"click","source_artifact_ids":["tool-run-0001"]}],"generated_ratio_bp":0,"languages":[{"detection":"declared","name":"python","source_artifact_ids":["tool-run-0001"]}],"max_file_bytes":38210,"package_managers":[{"detection":"declared","name":"pip","source_artifact_ids":["tool-run-0001"]}],"repository_kinds":["application","cli"],"sensitive_operations":[{"path":"src/example.py","reason_codes":["PROCESS_EXECUTION_SINK"],"source_artifact_ids":["tool-run-0001"],"symbol":"run_command"}],"support_level":"supported","total_bytes":512000,"trust_boundaries":[{"path":"src/cli.py","reason_codes":["CLI_TO_PROCESS_BOUNDARY"],"source_artifact_ids":["tool-run-0001"],"symbol":null}]}